{
  "schema": "berth.packages/v1",
  "org": "acme",
  "file": "<RUN>/state/orgs/acme/config/packages.txt",
  "entries": [
    "@playwright-chromium",
    "libpq-dev",
    "Bad_Name"
  ],
  "packages": [
    "fonts-freefont-ttf",
    "fonts-ipafont-gothic",
    "fonts-liberation",
    "fonts-noto-color-emoji",
    "fonts-tlwg-loma-otf",
    "fonts-unifont",
    "fonts-wqy-zenhei",
    "libasound2",
    "libatk-bridge2.0-0",
    "libatk1.0-0",
    "libatspi2.0-0",
    "libcairo2",
    "libcups2",
    "libdbus-1-3",
    "libdrm2",
    "libfontconfig1",
    "libfreetype6",
    "libgbm1",
    "libglib2.0-0",
    "libnspr4",
    "libnss3",
    "libpango-1.0-0",
    "libpq-dev",
    "libx11-6",
    "libxcb1",
    "libxcomposite1",
    "libxdamage1",
    "libxext6",
    "libxfixes3",
    "libxkbcommon0",
    "libxrandr2"
  ],
  "invalid": [
    "Bad_Name"
  ],
  "base_image": "berth/claude-env:<HASH>",
  "image": "berth/claude-env-acme:<HASH>-<HASH>",
  "built": true
}
